{"baseline_sha256":"sha256:e5e5e5e5e5e5e5e5e5e5e5e5e5e5e5e5e5e5e5e5e5e5e5e5e5e5e5e5e5e5e5e5","coverage_changes":{"supervision":{"new":"comprehensive","old":"undeclared"}},"host":"ed25519:a1a1a1a1a1a1a1a1a1a1a1a1a1a1a1a1a1a1a1a1a1a1a1a1a1a1a1a1a1a1a1a1","hunks":{"supervision":{"service":{"com.tendcf.caddy.main":{"new":{"bundle":"caddy","command":["/opt/homebrew/bin/caddy","run","--config","/etc/caddy/Caddyfile"],"env":{"CADDY_ADMIN_TOKEN":"CADDY_ADMIN_TOKEN"},"run_as":"caddy","state":"present","unit":{"launchd":{"keep_alive":true,"run_at_load":true}},"working_dir":"/"}}}}},"proposed_sha256":"sha256:ad0cb7c024dce9e6f80b388d47f7893bcc1f69c0ccd9ede36aeca095eae19867","schema_version":1}